<?xml version="1.0" encoding="UTF-8"?>
<!DOCTYPE osgr SYSTEM "osgr.dtd">
<osgr xmlns="http://graph2svg.googlecode.com"
		yAxisType="dateTime"
		yAxisLabelsFormat="[MN,*-3] [D01] [h02]:[m01]"
		colorScheme="grey">
	<names>
		<name>1</name>
		<name>2</name>
		<name>3</name>
		<name>4</name>
		<name>5</name>
		<name>6</name>
		<name>7</name>
		<name>8</name>
		<name>9</name>
		<name>10</name>
		<name>11</name>
		<name>12</name>
		<name>14</name>
	</names>
	<values>
		<value>2010-01-21T11:12:04</value>
		<value>2010-01-21T14:04:00</value>
		<value>2010-01-22T01:35:00</value>
		<value>2010-01-21T23:50:04</value>
		<value>2010-01-21T18:00:30</value>
		<value>2010-01-21T16:40:00</value>
		<value>2010-01-21T14:40:00</value>
		<value>2010-01-21T17:00:00</value>
		<value>2010-01-21T16:00:00</value>
		<value>2010-01-21T15:00:00</value>
		<value>2010-01-21T14:00:00</value>
		<value>2010-01-21T13:00:00</value>
		<value>2010-01-21T12:00:00</value>
	</values>
	
</osgr>